{
  "schema_version": "1.0",
  "kind": "framework-installation",
  "framework_version": "0.2.0.dev0",
  "schema_compatibility": "1.0",
  "installation_status": "installed",
  "manifest_ref": ".codex/framework/manifest.json",
  "owned_roots": [
    ".codex/framework.json",
    ".codex/framework/",
    ".codex/tools/",
    ".codex/agents/",
    ".codex/templates/",
    ".codex/workflows/",
    ".codex/requirements.txt",
    ".codex/.gitattributes"
  ],
  "project_owned_roots": [
    ".codex/README.md",
    ".codex/AGENTS.md",
    ".codex/STATE.json",
    ".codex/project/",
    ".codex/plans/",
    ".codex/decisions/",
    ".codex/research/"
  ]
}
