{
  "schema_version": "1.0",
  "kind": "framework-installation",
  "framework_version": "0.2.0.dev0",
  "schema_compatibility": "1.0",
  "installation_status": "source_foundation",
  "manifest_ref": null,
  "owned_roots": [
    "schemas/",
    "src/",
    "docs/agents/",
    "docs/templates/",
    "docs/workflows/",
    "docs/defaults/"
  ],
  "project_owned_roots": [
    ".ai/STATE.json",
    ".ai/plans/",
    ".ai/decisions/",
    ".ai/research/",
    ".ai/project/",
    ".ai/shared/"
  ]
}
