{
  "schema_version": "1.0",
  "kind": "framework-installation",
  "framework_version": "synthetic-example",
  "schema_compatibility": "synthetic-example",
  "installation_status": "source_foundation",
  "manifest_ref": null,
  "owned_roots": [],
  "project_owned_roots": [
    "synthetic-example"
  ]
}
